<?xml version='1.0' encoding='utf-8'?>
<?xml-stylesheet type="text/xml" href="product-syndication.xsl"?>
<!DOCTYPE comparison SYSTEM "product-syndication.dtd">
<product-syndication>
    <data>
        <cat id="books">
            <title>Books</title>
            <desc>
                <p>
                    These are my books.
                </p>
            </desc>
            <cat id="fiction_books">
                <title>Fiction books</title>
                <prod id="little_women">
                    <title>Little Women</title>
                    <isbn>0451529308</isbn>
                    <desc>
                        <p>
                            Little Women by Louisa May Alcott.
                        </p>
                    </desc>
                </prod>
                <prod id="around_the_world_in_80_days">
                    <title>Around the World in 80 Days</title>
                    <isbn>014036711X</isbn>
                    <desc>
                        <p>
                            Around the world by Jules Verne. About Fog and
                            Passpartu.
                        </p>
                    </desc>
                </prod>
            </cat>
            <cat id="computer_books">
                <title>Computer books</title>
                <prod id="programming_perl">
                    <title>Programming Perl, 3rd Edition</title>
                    <isbn>0596000278</isbn>
                    <desc>
                        <p>
                            The Camel Book.
                        </p>
                    </desc>
                </prod>
            </cat>
        </cat>
    </data>
</product-syndication>
